{
  "schema_version": "dual_prediction_batch_manifest_v1",
  "status": "passed",
  "report_units": 29,
  "forecast_windows": 87,
  "truth_accessed_during_prediction": false,
  "truth_opened_only_after_advisory_lock": true,
  "selection_lock_sha256": "bf3042bb27939b8a1c5b44c1e11c46f2e1efc6d4ea41036390b73acd740c52a1",
  "artifacts": [
    {
      "path": "handoff/reports/dual_prediction_batch_v1/adm1_full_process_data.csv",
      "sha256": "849975389cb62c364fe8627a57f020cc03d3764ac3e1c37213e24dc6ee024cb3",
      "size_bytes": 195551
    },
    {
      "path": "handoff/reports/dual_prediction_batch_v1/forecast_materialization.json",
      "sha256": "233cf331ce6b86f48c90a4880f4d5db8147fb03d32c7731cc34b6d97ede02416",
      "size_bytes": 15039
    },
    {
      "path": "handoff/reports/dual_prediction_batch_v1/llm_advisory_prediction_lock.csv",
      "sha256": "2ff5818f15c1fc6917324dc0b81b4295267251c7a4ae8dd2cb4c7dadf288d9e1",
      "size_bytes": 6495
    },
    {
      "path": "handoff/reports/dual_prediction_batch_v1/neo4j_publish_audit.json",
      "sha256": "175d8ccbd8ae4e8f9fbb8de318812c3f4fbd831bb86cadc52fc1ca1ef1344e3c",
      "size_bytes": 509
    },
    {
      "path": "handoff/reports/dual_prediction_batch_v1/report_progress.csv",
      "sha256": "5837692b4cd36acb184fe4638e75b4ff6c84e35bee44e712ea2c1bd02563b6c1",
      "size_bytes": 7497
    },
    {
      "path": "handoff/reports/dual_prediction_batch_v1/reports/heatwave/development/20180601_00_SA-04.evidence.json",
      "sha256": "6ee1ba4887c051149ec73dcb0835e4721a92e769528e6c20a9432c99055b7537",
      "size_bytes": 11030
    },
    {
      "path": "handoff/reports/dual_prediction_batch_v1/reports/heatwave/development/20180601_00_SA-04.json",
      "sha256": "59b9316e08c2bca91659dbb8f82ebe6ea7264cf4b78863b252b52007d0a07fe6",
      "size_bytes": 8704
    },
    {
      "path": "handoff/reports/dual_prediction_batch_v1/reports/heatwave/development/20180601_00_SA-04.md",
      "sha256": "4d2f7f2ad82235d88f432df1bfd21b9d939371e8621149fd99d947b9134221e6",
      "size_bytes": 6608
    },
    {
      "path": "handoff/reports/dual_prediction_batch_v1/reports/heatwave/development/20180614_00_SA-04.evidence.json",
      "sha256": "a95465f8cabeb10b70e43dd5c129e97fe57b2f0d646f1b39ed63c40fb99cf4ac",
      "size_bytes": 11019
    },
    {
      "path": "handoff/reports/dual_prediction_batch_v1/reports/heatwave/development/20180614_00_SA-04.json",
      "sha256": "2b35d7e97361f069506ec8d42a518b6890425dff1938d633e6dc8aed8cabc734",
      "size_bytes": 7635
    },
    {
      "path": "handoff/reports/dual_prediction_batch_v1/reports/heatwave/development/20180614_00_SA-04.md",
      "sha256": "632685427d351a4694a50813f7f2bf3b60406d9678abaf647060384557f98f66",
      "size_bytes": 5733
    },
    {
      "path": "handoff/reports/dual_prediction_batch_v1/reports/heatwave/development/20180619_00_SA-03.evidence.json",
      "sha256": "9081dce6e73bcc9c43b2bcc272c1d59d4303b3a257bff5c6e88d5c121c261efd",
      "size_bytes": 10980
    },
    {
      "path": "handoff/reports/dual_prediction_batch_v1/reports/heatwave/development/20180619_00_SA-03.json",
      "sha256": "7cd0394c299e5c84f95802d4f9f23230254041583e42306d616e29f51298bf83",
      "size_bytes": 7887
    },
    {
      "path": "handoff/reports/dual_prediction_batch_v1/reports/heatwave/development/20180619_00_SA-03.md",
      "sha256": "4cd8d1f5c6e13e22e2a89e951c764b1f8834d05161905d690fd56e94d6cb6cec",
      "size_bytes": 5989
    },
    {
      "path": "handoff/reports/dual_prediction_batch_v1/reports/heatwave/development/20180623_00_SA-03.evidence.json",
      "sha256": "2b73741440f62bc20496541493f47e93b5cf567efa7eb579092651193095f9f8",
      "size_bytes": 10998
    },
    {
      "path": "handoff/reports/dual_prediction_batch_v1/reports/heatwave/development/20180623_00_SA-03.json",
      "sha256": "1c13e2204ab2ed638a92a3685a5ca01627082aac56ac0b8387afec3ad1b06cda",
      "size_bytes": 7605
    },
    {
      "path": "handoff/reports/dual_prediction_batch_v1/reports/heatwave/development/20180623_00_SA-03.md",
      "sha256": "c1d27c5651a4f0b8a7dfa8cf74ef16fd19db25c9cc01f09092b4f6f0fe31c645",
      "size_bytes": 5704
    },
    {
      "path": "handoff/reports/dual_prediction_batch_v1/reports/heatwave/development/20180709_00_SA-04.evidence.json",
      "sha256": "a70c139ddf573ad001b6991fa59c7cfc6e309681da271a8bf53fbcbb9a4adf5d",
      "size_bytes": 11039
    },
    {
      "path": "handoff/reports/dual_prediction_batch_v1/reports/heatwave/development/20180709_00_SA-04.json",
      "sha256": "e061029e011aceea04cc4ace53ea9dde25f5175055f9e352b2dad2d2a1249864",
      "size_bytes": 8247
    },
    {
      "path": "handoff/reports/dual_prediction_batch_v1/reports/heatwave/development/20180709_00_SA-04.md",
      "sha256": "b241edb19a4ff66448ca388490e778e59a5f12d45b6f736abde937187dbc244d",
      "size_bytes": 6289
    },
    {
      "path": "handoff/reports/dual_prediction_batch_v1/reports/heatwave/development/20180719_00_SA-04.evidence.json",
      "sha256": "d889afe75b03bbc4f2e64387f6b2f82183be2cf8dae5244f1e8d5dde33f47c8f",
      "size_bytes": 11017
    },
    {
      "path": "handoff/reports/dual_prediction_batch_v1/reports/heatwave/development/20180719_00_SA-04.json",
      "sha256": "f3a77b80a234bd15bd047ea98e16908ba4cc75e0f2492ded2952155391053232",
      "size_bytes": 8351
    },
    {
      "path": "handoff/reports/dual_prediction_batch_v1/reports/heatwave/development/20180719_00_SA-04.md",
      "sha256": "058411587c4fed56e74ba90761eaa2cde0b2d5f3de450b003adf530adcecbc77",
      "size_bytes": 6377
    },
    {
      "path": "handoff/reports/dual_prediction_batch_v1/reports/heatwave/development/20200619_00_SA-04.evidence.json",
      "sha256": "58d789e1a8f35077398123b6dce36b39896f87663845b2ad3bb588893819107a",
      "size_bytes": 10995
    },
    {
      "path": "handoff/reports/dual_prediction_batch_v1/reports/heatwave/development/20200619_00_SA-04.json",
      "sha256": "60fb5d7f1d1aff73e65b6d780120961e3b505537636d07c80fb87ee764462829",
      "size_bytes": 8771
    },
    {
      "path": "handoff/reports/dual_prediction_batch_v1/reports/heatwave/development/20200619_00_SA-04.md",
      "sha256": "6b0827c03dfd6be586ea0135469cff1f6e952f3a2f9a258509487ffd1dd19d24",
      "size_bytes": 6629
    },
    {
      "path": "handoff/reports/dual_prediction_batch_v1/reports/heatwave/development/20200622_00_SA-04.evidence.json",
      "sha256": "06181192c708809192f54b7a1f7062d3479c849ef72f36a093f9de0265ca8409",
      "size_bytes": 10997
    },
    {
      "path": "handoff/reports/dual_prediction_batch_v1/reports/heatwave/development/20200622_00_SA-04.json",
      "sha256": "799a50cdee9542df08c540aebc6048d5bf2bef1863e3c627d3a12489057975cd",
      "size_bytes": 8232
    },
    {
      "path": "handoff/reports/dual_prediction_batch_v1/reports/heatwave/development/20200622_00_SA-04.md",
      "sha256": "4663ce2ce78810f966d11895b4038923025f2a5322cc115e5bef493c5c6b3b79",
      "size_bytes": 6146
    },
    {
      "path": "handoff/reports/dual_prediction_batch_v1/reports/heatwave/development/20200623_00_SA-08.evidence.json",
      "sha256": "3c1df0b9ba1f2313d5e7fa5d5dad74bfd26fe917f5bc774736d184506ac0d926",
      "size_bytes": 11003
    },
    {
      "path": "handoff/reports/dual_prediction_batch_v1/reports/heatwave/development/20200623_00_SA-08.json",
      "sha256": "5cb8c941f183efb335492b7363901cc67a7e91ce53de7e58fcc8f26d3c02b5af",
      "size_bytes": 7541
    },
    {
      "path": "handoff/reports/dual_prediction_batch_v1/reports/heatwave/development/20200623_00_SA-08.md",
      "sha256": "57e7d50404fa836fa7aef886d4345760f2c31a3c4c52c300021be460b70ab75d",
      "size_bytes": 5636
    },
    {
      "path": "handoff/reports/dual_prediction_batch_v1/reports/heatwave/development/20200627_00_SA-04.evidence.json",
      "sha256": "03beb9c51f6ff40e537e9797222703d0be55bee1ec86f6b4da83d8340e90018e",
      "size_bytes": 11015
    },
    {
      "path": "handoff/reports/dual_prediction_batch_v1/reports/heatwave/development/20200627_00_SA-04.json",
      "sha256": "d5f66d272d2bd4504bdd32865a7e34e7d26ba19fabb82c7311e657896373648f",
      "size_bytes": 8869
    },
    {
      "path": "handoff/reports/dual_prediction_batch_v1/reports/heatwave/development/20200627_00_SA-04.md",
      "sha256": "31cdc8fe390e89f4f6f197857c9d0f68390c3db151624218957e4d50836aa717",
      "size_bytes": 6647
    },
    {
      "path": "handoff/reports/dual_prediction_batch_v1/reports/heatwave/development/20200702_00_SA-08.evidence.json",
      "sha256": "b28f0a820cedf4cf6d42af467ba3568cb10b3a9e08a65f19c795de0cf357416b",
      "size_bytes": 11007
    },
    {
      "path": "handoff/reports/dual_prediction_batch_v1/reports/heatwave/development/20200702_00_SA-08.json",
      "sha256": "736d83b45c6703cd04ea272da2b8c6c3039054652874e70781cd5bfb50ef4edd",
      "size_bytes": 7258
    },
    {
      "path": "handoff/reports/dual_prediction_batch_v1/reports/heatwave/development/20200702_00_SA-08.md",
      "sha256": "0499ea64091ae93ae4b23f903d56fafb244841f45f1f984b50b53dc27081a9a5",
      "size_bytes": 5353
    },
    {
      "path": "handoff/reports/dual_prediction_batch_v1/reports/heatwave/development/20200706_00_SA-04.evidence.json",
      "sha256": "f51b2bcb690e09e91b8ee82680d1483ab78fc9c367e6ab41eaba9d6a6f112783",
      "size_bytes": 11010
    },
    {
      "path": "handoff/reports/dual_prediction_batch_v1/reports/heatwave/development/20200706_00_SA-04.json",
      "sha256": "3e0f2e28e9a62cd36766eb8b103058c12d677cb7a36b2e4e6b622cb555c248e7",
      "size_bytes": 8283
    },
    {
      "path": "handoff/reports/dual_prediction_batch_v1/reports/heatwave/development/20200706_00_SA-04.md",
      "sha256": "85101053a6c7bd7ebb7324e70863ca25fff5a29d736ea84e67735de12a7551e0",
      "size_bytes": 6439
    },
    {
      "path": "handoff/reports/dual_prediction_batch_v1/reports/heatwave/development/20200715_00_SA-04.evidence.json",